{
  "airpp_version": "0.2.0",
  "manifest_id": "airpp-mf-auditable-001",
  "conformance_level": "auditable",
  "created_at": "2026-04-25T09:00:00Z",
  "report": {
    "report_id": "report-basic-001",
    "title": "Example Internal Briefing",
    "output_type": "policy_briefing",
    "language": "en-GB",
    "created_at": "2026-04-25T08:30:00Z",
    "current_version": "1.0.0",
    "intended_use": "internal_review"
  },
  "ai_involvement": {
    "level": "language_assist",
    "human_final_responsibility": true,
    "summary": "AI was used to improve clarity and structure. The final document was reviewed by a human."
  },
  "actors": [
    {
      "actor_id": "actor-human-001",
      "actor_type": "human",
      "display_name": "Responsible Author",
      "role": "author_and_reviewer",
      "organisation": "Example Organisation"
    },
    {
      "actor_id": "actor-ai-001",
      "actor_type": "ai_service",
      "display_name": "Example AI Service",
      "role": "generation_assistant"
    }
  ],
  "content_blocks": [
    {
      "block_id": "block-001",
      "block_type": "section",
      "title": "Executive Summary",
      "ai_involvement": "draft_assist",
      "verification_status": "human_checked"
    }
  ],
  "sources": [
    {
      "source_id": "src-001",
      "source_type": "document",
      "title": "Source Pack",
      "uri": "internal://source-pack",
      "use_state": "relied_upon"
    }
  ],
  "generation_events": [
    {
      "event_id": "gen-001",
      "event_type": "ai_generation",
      "occurred_at": "2026-04-25T08:40:00Z",
      "actor_id": "actor-ai-001",
      "target_block_ids": [
        "block-001"
      ],
      "input_refs": [
        "src-001"
      ],
      "prompt_record": {
        "capture_mode": "summary",
        "prompt_summary": "Draft executive summary from source pack."
      },
      "ai_involvement": "draft_assist"
    }
  ],
  "review_events": [
    {
      "review_event_id": "rev-001",
      "event_type": "human_review",
      "occurred_at": "2026-04-25T08:55:00Z",
      "actor_id": "actor-human-001",
      "review_type": "factual_check",
      "review_outcome": "approved"
    }
  ],
  "verification_records": [
    {
      "verification_id": "ver-001",
      "target_type": "content_block",
      "target_id": "block-001",
      "verification_status": "human_checked",
      "checked_by": "actor-human-001",
      "checked_at": "2026-04-25T08:56:00Z"
    }
  ],
  "exports": [
    {
      "export_id": "export-001",
      "export_type": "pdf",
      "created_at": "2026-04-25T09:00:00Z",
      "created_by": "actor-human-001",
      "manifest_mode": "detached"
    }
  ],
  "integrity": {
    "manifest_hash": {
      "algorithm": "sha256",
      "value": "REPLACE_WITH_MANIFEST_HASH"
    },
    "signature_status": "unsigned_signing_ready"
  }
}
